existence,tweet
2,funny timely oil spill gulf new az law pushed climate change bill away drawn foh immigration reform
1,epa issue repo u climate change indicator warming measurable effect across ecosystem
0,legislature global warming conspiracy examinercom ap photo state representative mike noelr kanab believ
0,climbing dark top 10 global warming myth ipcc taking real heat everyday p
0,give egore 's climate groupie time2 come hair brained excuse ing man made global warming snow
0,snow blamed global warming mean global cooling mean oh know 's bull anyway
2,tornado global warming hurricane
2,professor klaus lauckner climate change panel april 22
0,good question time another blizzard 's global warming
2,tory candidate wo n't sign climate change new politics left foot fo via
2,declaration woman asia climate change
0,purpose int ' l cous 2 prosecute crime humanity everyone behind global warming fraud belongs cou
2,federal climate change forecasting agency launched
0,house committee seek keep global warming law utah utah lawmaker want send strong message
2,forest connection international climate change discussion continue ci 's leader paners explain
0,winter proof god sense humor expense climate change worshiper
1,signed petition take action climate change via
1,global warming bill blocking epa authority curb global warming pollution
0,obama new hitler campus disappointment 'll graduate believing global warming & unemployed get clue
0,overwhelming evidence global warming falling sky dc & gt live
0,geoengineering inevitable playing god false pretense climate change
0,global warmingclimate change folk switch message fighting pollution
1,krugman make case cap trade climate change building green economy nytimescom
1,nine awesome way fun going green cooler planetsure global warming alarming serious con
2,climate change legislation dead 2010
2,un climate head pressure quit source australian head un 's climate change body
1,save whale 'll save u global warming
0,dhs cite global warming security threat um worry le temp planet temp terrorist undies
1,global warming science good news soil release le carbon though world warms
0,green worse child abuser global warming swindle
2,senator prepare compromise climate change bill reuters
2,nytimesandrew revkin matthew nisbet urge better communication climate change
0,'re one 10 thousand without power blizzard voted global warming dipshit 'm glad 're fd
1,taking lead change
1,walk april 26th 1pm climate change ca n't wait see action consumer take
1,global warming world black people coal mine
1,porous material reduce climate change
1,cleaner air could speed global warming
0,studied eah science undergrad & grad student proven science fact open debate like global warming
0,whiche lie distoion truth referring congressional perk global warming
0,climatechange fanatic corrupted science michael barone gopusa via
2,dollar sense climate change
0,thanks global warming snowstorm e coast blizzard tied climate change via
0,global warming anyone would found would havent looked yet
0,want play golf tomorrow think global warming wo n't let remains cold houston
0,global warming anyone would found would havent looked yet
1,science whale fight global warming
0,40 degree nyc please urinate next liberal global warming climate change scum see
1,latest weapon global warming fight greencement made rice fiona macleod ruairi creaney scienti
2,backing climate change
1,ol news ocean reveal fuher impact climate change
2,climate top coal exec testify global warming panel
2,
0,tax n't mind paying 's tax funding climate change research bother 's really useful
1,view newest blow global warming theory rush impose draconian regulation fight global warmi
0,man made global warming hair brained theory 4 scientifically challenged ippc nothing back claim
0,global warming alarmist meet record snowfall record snowfall meet global warming alarmist
2,india set panel climate change amid controversy un repo melting himalayan glacier
0,major study global warming graph junk science
1,un accelerated migration climate change arecipe social disastervia
1,whale poo save world global warming save whale 'll save say australian scientist
0,watchingjoseph d'aleo full interview global warming hoaxat vodpod
0,global warming huh lied al gore duped
0,global warming nutjobs sign 's going keep snowing dc al gore cry uncle
0,im still snowing dear al gore bite oh wait claimign caused climate change right as
2,way difficult economy helped people focus family climate change clinical trial collagen
2,brilliant tip valentine 's day screaming climate change clinical trial collagen clinique clip
1,climate change climate life treehugger via
0,great global warming collapse
0,cambio climtico poblacin global warming skepticism finally made latin america
0,global warming activist snowmageddon result warming+moisture asked snow king syracuse ny snow reply uh
1,actress q'orianka kilcher climate change activism public figure celebrity responsibility help
0,weather channel founder want sue al gore global warming fraud
1,addressing global warming retrain coal worker green job
0,climate change ruse unravels
2,immigration reform climate change tale two issue senate
2,'s global warming
0,claiming climate change man made effect life dont change way complete bullshit tree hugger harm u
0,global warming plot coloradoans get oceanfront propey without moving
0,first global cooling global warming 's climate change aka weather simple
2,global warming new ombudsman eurasia review sonali huria ipcs global warming purpoedly put
0,quick al gore say something obama need distraction tell u world going end cause global warming
2,thr climate bill give polluter nuclear break washington reuters u climate change bill expected
1,climate denial crock week 's cold 's climate change
0,turn groundhog saw shadow day 6 week winter wheres global warming people
2,cochabamba water war climate change
1,economics must align climate change
2,church climate change yuval levin president bush created faithbased office white h
2,global warming play decide info & discussion game structured discussion three stage global
1,global warming make tree grow faster
1,everyone think disproves global warming ur wrong
2,new federal climate change agency proposed
0,another snowstorm happened global warming bryan walsh wednesday feb 10 2010 alex brandon ap
2,fat loss program screaming climate change clinical trial collagen clinique clip clothes clo
1,homeimprovement project consider larger home eah help stop global warming check
0,new hannity snow stormscontradict gore 's global warming theory
1,claiming snow disproves global warming like gf w 12 strapon & claiming big dick
0,give egore 's climate groupie time2 come hair brained excuse ing man made global warming snow
2,usa sec issue guidance climate change disclosure
2,epa make case climate change
0,tweetdeck frozen global warming
2,people often finding waiting long line climate change clinical trial collage
0,omg al gore forgot tell mother nature ca n't blizzard global warming occurring
1,global warming make allergy worse 25 million american hitting asthma hardest wwf climatewire
2,diplomacy sec clinton admitted u funding change may additional
2,climate bill give polluter nuclear break washington reuters u climate change bill expected
0,'s climate change bogus global warming consensus fading fast
0,blankenship mine safety regulator silly global warming
2,american dont give **** global warming survey say retail investor city u fe
1,addressing global warming retrain coal worker green job perfect storm factor massing con
0,hmmm global warming fraud
0,horner challenge climate change data much current global warming theory based distoions scientific
2,american dont give **** global warming survey say retail investor city u fe
1,take climate change seriously & business hold responsible impact learn
2,tv weathercasters divided global warming half believe phenomenon exists say 's scam
1,global warming likely cause australia 's drought australia 's longstanding drought likely arises global wa
1,un accelerated migration climate change arecipe social disastervia
1,guess need stop saying global warming & replace w climate crisis repub 's sake gw sho circuit brain
2,virginia investigate global warming scientist mann
0,said day ago sta seeing much tempered repoing global warming staing w
1,alaska effect global warming pic
1,fox news al gore 's book global warming snow one straight news show
1,tobacco climate changemerchants doubtundermined science via
1,krugman make case cap trade climate change building green economy nytimescom
1,need know climate change via
1,government repo say global warming may cause cancer mental illness cnsnewscom
2,call global warming studiessnake oil
0,global warming going dc office hope 're nice toastyoh wait scam thnx
1,explorer discus global warming renowned polar explorer adventurer steger present free program
0,bogus global warming consensus fading fast
2,india want global warming saying trust un
1,reference frame global warming cause snowstorm dc
2,rb face climate change protest business guardiancouk via
0,climate change regulation stupid thought & waste time disproved one initiated hypothosys idiot
0,medium matter still using junk science 2007 ipcc repo global warming
1,2010 leadership summit highlight role biotechnology innovation reducing climate change emission
1,'s hot seattle take junk mail industry come curbing climate change thing easi
2,climate change legislation dead 2010
1,climate change = snowstorm
2,going big health care democrat still plan legislation bank reform climate change immigration
0,scam another warmist rescued arctic cold global warming activisttranspoed
1,global warming killing canadian wolverine
0,al gore arrested global warming scam much al take $ $ $ $ $ $ $ $ $ $ forget snow ball hit shovel
1,climate change mk world fragrant warming temperature mk plant release chems via
2,& change immigrant voice know
0,medium matter still using junk science 2007 ipcc repo global warming
0,winter likely put dagger hea global warming cause rightwing republican put together
1,geol society update statement humandriven climate change synching ipcc nat acad agu etc
2,immigration reform climate change tale two issue senate
1,oddball winter weather ed global warming check story *****homepage
1,suppo world people 's conf climate change cochabambaboliviawatch live
2,tension set wedding ring found style fit every climate change clinical trial collagen
2,warming calif program delayed job initiative n't misled
1,right richard branson 's message 2 biz get ur house orderfight global warming
1,royal society stunner hazardous geosphere activity global warming ed period exceptional climate chan
1,q focus energy climate change immigration via
2,think man control global warming racist
0,utah state representative claim climate change aconspiracyaimed population control
0,exposing global warming crapola
1,cochabamba summit offer new approach combating climate change
2,climate change bill limbo following white house push immigration reform bill dead e
0,im still snowing dear al gore bite oh wait claimign caused climate change right as
1,counting world people 's conf change 1922 april watch live
1,know way help stop global warming global warming
2,comedian jokedwe n't know global warming manmade know global warming data manmade
0,climate change global hoax
0,think agree prius disaster prof global warming n't exist via
0,global warming hysteria presumes 3 thing 1 exists 2 manmade 3 bad 3 must true winter may prove 3 false
2,sharifkouddous indigenous group across bolivia arriving world people 's conference climate change
2,video larry brilliant volcano climate change boing boing via
0,bogus global warming consensus fading fast
0,climate change regulation stupid thought & waste time disproved one initiated hypothosys idiot
0,americablog news rightwingers already claiming blizzard prof climate change via
2,global warming fiction fact denier claim either global warming due
1,climate change acidification threaten 82 type coral
2,paul rogat loebsoul citizen ' jesus climate change journey evangelical leader rich cizik
0,global warming
0,blankenship call effos mine safety regulationas silly global warming ' labor day antiunion
0,green worse child abuser global warming swindle
2,bbc news election 2010 pay battle climate change via
0,rich galen global warming another dc snow job blizzard
2,climate top coal exec testify global warming panel
1,really think snowstorm disprove change yup show idiotic
2,actual provide utilizing automatic global trade swapping climate change clinical trial collage
2,pm 's stand copenhagen snub un climate change secretariat india time india via
2,legislative steamrolling kathryn jean lopez april 26 bloomberg immigration climatechange legisl
1,california network monitor globalwarming emission
2,global warming science fair test
0,make sense think agree prius disaster prof global warming n't exist
2,olympic organiser desperate climate change humanitarian news via
1,arctic beauty black white alaska effect global warming slide show
1,anchor rising environmental mandate rhode island may take another step toward addressing climate change issu
2,tension set wedding ring found style fit every climate change clinical trial collagen
1,global warming movement n't require credibility 's based science denial lack weight
0,hmm 's february 30 snow dc sun shining grass chicago global warming karma
1,check cost climate change
1,estimated 20 billion bird changed migrating habit last decade due global warming
0,im still snowing dear al gore bite oh wait claimign caused climate change right as
0,snow trending al gore expe global warming lately want 2 hear 2 say record breaking snow fall
2,brandrep asa dismisses complaint dft climate change ad london adveising standard authority
1,gop pollster frank luntz counseled bush buy science global warming changing view
1,climate change impact vulnerability eastern himalaya indigpplsrsrcs
0,scam scam scam eu parliament member rip global warming hysteria
2,check video george carlin global warming
1,pulitzer prize author brings global warming light chelsea dr henry pollack professor emeritus
2,obama id hire gore climate change p
1,'s 83 climbing nyc august weather first day may unbelievable chalk global warming
1,cochabamba summit offer new approach combating climate change
2,global warming new ombudsman eurasia review sonali huria ipcs global warming purpoedly put
2,water war climate change thehea bolivia
2,global warming fiction fact denier claim either global warming due
2,india need research climate change shyam saran via
1,pat mooney danger geoengineering manipulating planet combat climate change
0,'s settled global warming science sloppy according last ipcc repo published 2007 55 %
0,climatechange fanatic corrupted science michael barone gopusa
1,photo dare someone tell u climate change n't real
1,global warming repo urge government act brussels belgium ap world face increased hunger
2,whale excrement check global warming topnews united state new researcher carried australian antarc
2,kindling controversy hansen mckibben revkin & lomborg climate change guru met nyc 8pm thurs 42910
0,rich galen global warming another dc snow job blizzard
0,good question time another blizzard 's global warming
1,global warming contributes rapidly increased ocean acidification u national research council warned last
2,hilarious complimenti baked alakasa sarah palin 's guide global warming
0,british public become increasingly sceptical change bbc via
2,california 's global warming law halted focus job
1,global climate yes 's still warming treehugger brian merchant brooklyn new york 02 410 many
1,one proposed solution global warming grow large number tree global warming solution
1,royal society stunner hazardous geosphere activity global warming ed period exceptional climate chan
1,climate change know frightened nuclear power know least frightened various
2,tv weathercasters divided global warming thought
2,senator prepare compromise climate change bill yahoo news
0,global warming busted president
2,climate change initiative
2,brandrep asa dismisses complaint dft climate change ad london adveising standard authority
2,tale 2 issue immigration reform getting traction climate change senate
1,global warming make blizzard worse
0,time investigate socialist democrat political manipulation global warming data fine jail time follow
2,rim winning risk managersminds climate change
1,china key fixing global warming rapid expansion come sizable environmental impact world 's
0,oops rfk jr 15 month ago global warming mean snow cold dc
2,immigration climate change via
2,virginia 's governor believe global warming
0,hmmm global warming fraud
0,tax n't mind paying 's tax funding climate change research bother 's really useful
0,global warming kinda blizzardy
2,abc label pachauri leading global warming scientist
1,despite sceptic climate change must remain priority editorial comment free via
1,gregory unruh oven dial light switch carbon lockin abrupt climate change well decade ago bec
1,global warming pounding east coast snow n't ask work 'm repoing
1,bat bird lizard fight climate change bird bat lizard may play impoant role eah 's cl
0,climate change ruse unravels
0,al gore preached climate change wanted u 2 care said & done evidence n't
0,people knew =p next thing 're going blame global warming dihydrogen monoxide
0,excellent aicle fellow former liberal global warming cultism
1,engaging climate change sceptic rational discussion science giving fruitcake fieldday
0,global warming rebecca terrell newamericancom
2,india form new climate change body
2,exaggerated climate change claim causing backlash debunked
1,climate change affect subterranean ecosystem change ground higher concentration carbon
1,fighting povey global warming africa marc gunther 04212010 2210 0 comment 0 view rarely
2,climate change research bungle telegraph via
1,10 thing reduce global warming _
2,hill online yesterday record snowfall buried washington & along w buried chance passing global warming legislation yr
2,comedian jokedwe n't know global warming manmade know global warming data manmade
2,global warming denier take note according bon jovi tour ad summer got hotter
2,usa sec issue guidance climate change disclosure
0,global warming hysteria another false claim exposed ipcc repo
1,cfc ban global warming 's pilot episode
0,global warming
2,internet dating screaming climate change clinical trial collagen clinique clip clothes clot
2,senate global warming hearing cancelled
0,1420 fml sorry htink im going team plain global warming exist
0,exposing global warming crapola
1,carbon age killing u climate change legislation
0,serious question environmentalist still blame human climate change volcano
0,blankenship mine safety regulator silly global warming
1,un global cooperation prevent runaway climate change secretary united nation seek dialogue
1,climate change threatening glacier national park montana 's economy examinercom
2,obama id hire gore climate change p
1,global warming impact wheat rice production india ludhiana apr 18 scarcity water serious
2,foe california 's global warming law pour money campaign delay
1,river delta need back disaster hit video change
0,climate change ruse unravels
1,enviro european space agency launch satellite check climate change see blastoff= & gt
1,join meg caldwell tonight open talk coastal community & climate change california colloquium water
0,eddriscoll time admit climate change conservative conspiracy keep
0,human causing global warming ice cap ice cap indeed melting mar
0,senate global warming meeting hold record snow fall yes disproves global warmingif ur illiterate
0,scientific community scamed global green gov warming scam
1,heard interesting repo repo understanding climate changeclimate variability influence human evolution dispersal
1,global warming navy radar new normal arctic completely frozen new normal
1,climate change could raise cost u allergy reuters
1,'s climate change day today ask climate question via
1,tend think climate change result process
0,fuck mani biggest suppoehen let rain like noah arkfuck theory global warming
2,abc offer serious look global warming skeptic downplays climategate
1,global warming dent 's el ni ' 's protective shield atlantic hurricane increase drought
1,could cleaner air actually intensify global warming npr staff much world marked eah day past w
0,3minute eah day video fails mention global warming hoax '
1,clean air polluted community also addressing change
1,climate change culprit offthechas pollen count
0,30000 antiglobal warming scientist ca n't wrong stranger nature magazine academic journal int
1,cochabama people world conference climate change mother eah 's right
2,**pls smile ok** climate change human health studied bethesda md april 22 upi u national insti
0,man made climate crisis global warming hoax global warming
0,mmr doctor andrew wakefield fixed data autism time online sound like global warming hoax
0,global warming soo bad coolest summer ever
1,tennis great star billie jean king encourages everyone take mass transit great way help fight climate change
1,invasive news invasive specie thriving period climate change world sentinel invasive specie thriving
2,minister coal step climate change action
1,global warming believe vallejo timesherald editorial global warming keeping debate honest
1,global climate yes still warming climate scientist
0,al gore preached climate change wanted u care said & done evidence n't
0,saying n't gore wo n't give global warming gig still think invented internet
0,dc 's freezing cold really bad & storming bet folk could really use al gore 's global warming
2,un climate bos defends record rajendra pachauri embattled chairman un climate change panel lashed
2,climate lindsay graham 's suppo climate change legislation changed today lindsey graham
1,southern africa competing limpopo water climate change bring higher temperature southe
0,bogus global warming consensus fading fast margaret wente toronto 's globe mail explains w
2,33 u military general admiral climate change threatening
1,estimated 20 billion bird changed migrating habit last decade due global warming
2,climate bill placed hold senate dispute washington longawaited climate change legislation put
2,webb tout global warming depament little rock arkansas lawmaker authored legislation created
0,skeptic 's corner voter take global warming bit le seriously fromrasmussen repo monday april 19 2010 v
0,obama creates noaa climate serviceto help government & business adapt climate changeit obama life another planet
2,tale 2 issue immigration reform getting traction climate change senate ht
2,choice wont change world one might
1,flake global warming denier use massive snowstorm ammo
2,best core exercise plankback extension gaiam blog affirmation burncalories change climate change diet energy
0,global warmingclimate change folk switch message fighting pollution
2,third american believe global warming humancaused bob elli april 26th 2010 good news



