existence,tweet
2,immigration reform climate change tale two issue senate
1,issue global warming possible climate change issue global warming
1,irony deficient wapoon faithfrets climate change newsbustersorg via
2,overheard carol browner assistant president energy climate change mentioned
0,global warming fairy tale dick chaney n't drive suv 200000 year ago maybe
0,climatechange fanatic corrupted science michael barone gopusa
1,grape wrath much trouble change mean agriculture
1,state birds* repo show climate change impact wetland g hu via
1,fun game next time someone say much global warming push snowdrift run away
1,volcanic ash cloud global warming may trigger volcano climate change could spark more'hazardous '
2,new federal office global warming jennifer haberkorn washington time
0,idea care safety silly global warming massey energy 29 dead miner
1,krugman make case cap trade climate change building green economy nytimescom
0,wait 's idea 's natural climate change human induced global warming
2,mediated discourse climate change focus political subjectivity dis engagement
2,ecology based theologyglobal warming unclear god 's word isnt caring creation commanded stewardship
2,alexia park global warming hea
0,demand believe islam religion peace also demand believe anthropagenic global warming
2,robin hood tax home tiny tax finacial transaction tackle povey climate change h via
2,msnbc 's ratigan blamessnowpocalypseon global warming
1,top un environment official defends conclusion landmark climate change repo un news centre 6 february 201
0,saying n't gore wo n't give global warming gig still think invented internet
2,cnsnewscom onethird american believe climate change caused via
1,oh humanity global warming destroying los angeles change
1,romanticism undone invasive specie global warming taking toll plant thoreau 's walden pond
1,tell toyota coo put brake climate change & u coc digg q
0,time investigate socialist democrat political manipulation global warming data fine jail time follow
1,u document call global regime tackle climate change
2,commonsense & wonder global warming needed
0,global warming prolly real new york big scam dc
2,environmental economics note environmentalist pa ii climate change bill supposed unveil
0,got 14 inch snow thus far panther valley 30 min poconosmuch come yetas global warming & gt hum bug
1,shore drilling threatens wildlife contributes climate change urge obama expand drilling
0,great global warming collapse via
1,global warming killing california 's wine buzz dr kimberley cahill presented climate change califor
0,global warming activist snowmageddon result warming+moisture asked snow king syracuse ny snow reply uh
0,30 inch snow dc winter everywhere global warming yet myth persists
1,photo dare someone tell u climate change n't real
0,nearly 37 degree hot oh global warming im bath sweat ewww
0,soon patented haarp globalwarming conspiracy staed plus saw navy talking paper
0,blankenship call effos mine safety regulationas silly global warming
2,mistake found climate change repo
0,one stop book stop confirmed global warming issettled scam wndcom sussman 's book mybookstopinfo
1,feeling heat come climate change humanitarian news via
1,repo cleaner air could actually intensify global warming much world marked eah day past week environmental
2,internet dating screaming climate change clinical trial collagen clinique clip clothes clot
1,pb going green new york examining new yorkers confronting climate change check local listing
1,greencement made rice may help tackle global warming london april 13 ani increasing rise
1,man love global warming
2,omniclimate unbearable nakedness climate change via
2,noaa blizzard rearranges climate change announcement
0,voice fraud global warming tim michael case tracy since early 1970s public school syste
2,global warming rajendra pachauri order asbestos fire
0,oh well go global warming theory lol
1,dhs fossil fuel climate change arenational threat vladimir 's blog redstate includes great chas
2,lawmaker say removed panel global warming bill concern democratic member assembly
2,gawker logic repo lindsey graham 's climate change bill flipflop polidicks
0,group people would displeased winter global warming activist
2,rb face climate change protest business guardiancouk via
1,whale poo save world global warming save whale 'll save say australian scientist
2,paul rogat loebsoul citizen ' jesus climate change journey evangelical leader rich cizik
0,oops rfk jr 15 month ago global warming mean snow cold dc
2,anothen global warming result
2,weekend meeting discus china greece maybe global warming greg robb marketwatch washington marketwatch
1,nigeria climate change renewable energy master plan gov
0,coal ceo call mine safety rulesas silly global warming
1,invasive news climate change aid invasive plant upicom upicomclimate change aid invasive plantsupicomou
0,one stop book stop confirmed global warming issettled scam wndcom sussman 's book mybookstopinfo
1,looking great medium material human impact change check climate witness story
0,agree lawmaker climate change ruse control population
2,sec clinton admitted u funding change may additional said 's congress skip 5400
1,love frog 's leap seriously climate change mean wine industry via
2,john fugelsang climate change coal go shopping gun advocate rallied week suppo rig
0,blankenship called safety regulator silly global warming
2,climate top coal exec testify global warming panel
1,china key fixing global warming rapid expansion come sizable environmental impact world 's
1,global climate yes still warming climate scientist
1,ac enlisting drug discovery technique battle global warming
1,forest growing faster ecologist discover climate change appears driving accelerated growth
0,truly fat as gore get scam aist award decade global warming energy credit woh close billion
0,global warming cause eahquakes suuuuure
0,hey hey know get 's goat lol either lake level truth global warming hahaha
1,n't believe evolution denies climate change think africa 's country palin president
0,finally proof global warming co2 emission hoax familysecuritymattersorg
1,ask pablo impact volcano iceland climate change
0,climate change fraud global warming ethanol ddt
1,maybe 's ironic byproduct global warming new southern snowbelt
0,new hero gov christie cut $ 65 million nj 's global warming fund
2,hide declineglobal warming video creator say mann backlash effo tocleanupclimategate indiscretion
0,global warming baloney according expes nasa difference weather climate measure
2,u climate change negotiating plan revealed
0,green factdid know skeptic advocate agree global warming since 1995 change
2,science scientist explore evolution climate change
1,global warming next chapter
2,issue 2 wire climate change available free online
2,1pm foxnewscomgene koprowski seek expes increased federal spending global warming research
0,30 inch snow dc winter everywhere global warming yet myth persists
2,people world grand rapid mich opponent climate change legislation typically argue regulating globa
1,hedge climate change read post look weather product
1,climate change transforming arctic environment faster expected & accelerating disappearance sea ice
0,via rfk jr 15 month ago global warming mean snow cold dc via
0,junk science repoed fact stupid think time mag global warming make blizzard worse
1,need switch renewable energy climate scientist long warned u global warming accelerating
1,oven dial light switch carbon lockin abrupt climate change
2,global warming rajendra pachauri order asbestos fire
1,doubting global warming snow vancouver warmest winter record 's called trend line
0,target bullshit even better climate change hoax & gore climate change bullshit
2,un climate change body blasted greenpeace
2,global warming fanatic clash environmentalist redstate fuher proving consistent point global w
0,global warming established reality credible news source world debunking esp uk
1,excellent take even environmental economics limit climate change policy option
2,spring storm season staing little late year must global warming
2,global warming james cameron genocidal maniac john nolte either james cameron genocidal maniac
0,lisa p jackson epa ignorant black woman besides michelle obama seen long time global warming debunked stupidho
1,global warming make allergy worse 25 million american hitting asthma hardest wwf climatewire
0,great global warming collapse
1,dont kill bill save climate change accountability act
2,legislative steamrolling kathryn jean lopez april 26 bloomberg immigration climatechange legisl
1,harsh winter caused climate change
1,climate change watch india air pollution control
0,annnndwe snow annnnd snow snow even snow must global warming
1,climate change making sneeze ecosexy solution nettle root tincture baby
2,palin norcalglobal warmingsnake oil science ' former alaska gov sarah palin called study suppoing
0,global warming farce
1,global warming may make cricket bat history london cricket facing bizarre threat following european unio
2,foe california 's global warming law pour money campaign delay
0,despite climategate left investing heavily global warming hysteria new way 2 impose nat ' l & international control human freedom
2,graham 's exit talk put climate change bill limbo climatechange bill scheduled unveile
2,news corp aim go carbon neutral end year fox news claim climate change hoax
2,rb face climate change protest business guardiancouk via
2,un agrees host two round climate change talk summit mexico
1,maple syrup snow pack global warming happening stop global warming
0,made number false data east coast buried snow reason keep pushing global warming control money
0,new federal agency study global warming stop already
2,u climate change bill stall senate
0,snow blamed global warming mean global cooling mean oh know 's bull anyway
2,india pull un climate change body form
2,climate feb 8 u defense review serious climate change climate science fire burning bios
1,uk lead way schumacher college mobilising democracy tackle climate change
1,coda automotive lauded innovation technology effos combat climate change air pollution
2,legislative steamrolling kathryn jean lopez april 26 bloomberg immigration climatechange legisl
0,annnndwe snow annnnd snow snow even snow must global warming
1,weather event attributed exclusively climate change heavier precipitation consistent w climate scientiststheories
1,richard branson 's message 2 biz get ur house orderfight global warming http
0,hey hey know get 's goat lol either lake level truth global warming hahaha
2,global warming hoax find answer question think global warming hoax would anyone
1,blamessnowpocalypseon global warming
0,calling al gore dc need global warming please respond asap
2,climate change legislation agenda via
2,new federal climate change agency forming dc
2,uncajoe plz medium done global warming debate
2,global warming science noaa climate service obamas answer ipcc
2,climate change legislation dead 2010
1,wishing cochabamba people 's world conference climate change right mother eah
0,would like thank ruining bihday plan global warming need
1,global warming make tree grow faster
1,global warming governor heas rather wallet new jersey gov chris christie wised
2,climate change myth truth
2,communicating climate change kate sheppard politics beat
0,great pic weather caused global warming alarmist hell yes
1,environment climate change something simple reminding computer user power workin
0,time attack soft underbelly unsubstantiated global warming alarmism
0,wsj global warming alarmist discredited would n't know rhetoric eah day
1,volcano could mean cooling acid rain climate change msnbccom via
2,usa climate change policy update april 12 2010
1,take action help protect wildlife habitat climate change 27
0,global warming established reality credible news source world debunking esp uk
1,glacial melt global warming could unplug volcano eahweek diary planet eruption glacial vol
2,spain offers45 million un climate change adaptation fund oxfam via
1,take action help protect wildlife habitat climate change
2,change sec weighs
2,legislative steamrolling kathryn jean lopez april 26 bloomberg immigration climatechange legisl
2,true epa le susceptible congress lobbyist rush block epa action climate change
1,protip think snow cold rain negates global warming n't post show little know topic
0,global warming going dc office hope 're nice toastyoh wait scam thnx
0,global warmingreally control december 2009 141 scientist sent letter united nation
2,itz cold _ { could put body together n sta global warming }
0,bogus global warming consensus fading fast margaret wente toronto 's globe mail explains w
2,uploaded youtube video maximsnewsnetwork energy & climate change un 's ban kimoon untv
2,water war climate change thehea bolivia
1,global warming kill united nation
2,immigration reform climate change tale two issue senate
0,real science algore 's climate changesciencehacks manmade global warming hoax gore=palin
1,sometimes hard predict outcome climate change revolution v would exciting
2,ur tweet causing global warming lol
2,foe california 's global warming law pour money campaign delay
2,labour policy environment climate change energy policy labour 's environment energy climate change p
0,diigo climatechange fanatic corrupted science michael barone rcp
2,paul rogat loebsoul citizenexcerptfrom drunken pay girl climate change activist
2,legislative steamrolling kathryn jean lopez april 26 bloomberg immigration climatechange legisl
1,dc snowstorm global warming make blizzard worse
1,budburst volunteer needed look ten wanted plant ass clue climate change
2,survey gauge opinion global warming dan reiland uweau claire student displayed poster monday afternoon
1,varanasi hold fire ritual prevent global warming girish dubey varanasi feb6 large number
0,global warming rebecca terrell newamericancom
0,put end stupid global warming crap ask perves explain time ice age george dick driving suv 's suppose
1,ol news ocean reveal fuher impact climate change
2,good infoeasy read ir pro read sec climate change disclosure release guidance
0,soon patented haarp globalwarming conspiracy staed plus saw navy talking paper
2,usa climate change policy update april 12 2010
2,initiative campaign suspend global warming law ab32 repos $ 973k raised $ 500k oil comp valero
1,take action help protect wildlife habitat climate change 9
2,30 major league baseball team throw curve climate change denier cleantechnica
0,'s global warming another one phrase eliminated purposely used mislead
2,2 tory mp sign edm accepting climate change via
1,tonight 730 discus climate change woman child family & community
1,cynthia bateman meatwise monday animal agriculture make global warming worse
2,simple tip shopping grooved tungsten ring online climate change clinical trial collagen c
2,diplomacy sec clinton admitted u funding change may additional
2,obama id hire gore climate change p
1,video know human changing climate climate change clear present danger
0,mcewan take global warming solar nan talesedoubleday 287 page $ 2695 ian mcewan
2,omniclimate unbearable nakedness climate change via
0,okay back buz complaining snowuntil tuesday another 6 inch come notice talk global warming lately
0,tweet climate change massive fraud lie stuff 's funnier actually truthful
1,africa time bomb awaiting africa doubt climate change environmental issue ha
2,solar activity climate change
0,climate change loser bad better dumb buyer
1,check cost climate change
0,strange obama try kick sta congress snow maybe bipaisanship cure global warming
1,eah institute 's james hansen warns global warming new bookstorms grandchild
1,global warming killing california 's wine buzz dr kimberley cahill presented climate change califor
2,church climate change yuval levin president bush created faithbased office white h
0,yid lid ipcc 's latest climate change blundeo boldly go stupidity gone via
0,government run climatechange global warming sky falling get grip tree hugging wacko
1,change make farmer & pastoralists increasingly vulnerable
1,dr jeff master great blog storm & global warming
2,administration proposes new agency study climate change
1,30 major league baseball team throw curve climate change denier
1,shape global approach climate change davos le denmark one month copenhagen co
2,instapundit blog archive twelve inch global warming twelve inch global warming sound like p
2,global warming hysteria india threatens leave ipcc
0,climate change fraud global warming catastrophe surplus people pretending know th
1,climate change affect subterranean ecosystem change ground higher concentration carbon
0,global warming real cold small collection editorial caoons amusement
1,daily ko ecojustice system change climate change & violence right elected
0,give egore 's climate groupie time2 come hair brained excuse ing man made global warming snow
1,aware consume waste & treat place 1 & see global warming effect
1,take climate change seriously & business hold responsible impact learn
0,bogus global warming consensus fading fast
2,senator prepare compromise climate change bill
2,think global warming find answer question answer question think
2,12 % american worried global warming epa make case climate change
1,fight climate change front 5
2,climate bill give polluter nuclear break washington reuters u climate change bill expected
0,al gore arrested global warming scam much al take $ $ $ $ $ $ $ $ $ $ forget snow ball hit shovel
1,p global warming solution innovation climate change hand
2,watch pocahontas star interviewed climate change conference bolivia
2,rim winning risk managersminds climate change
1,human abuse result another horror story like global warmingand ever stop u think
0,man wish thing global warming
1,celebrate eah day signing declaration energy independence show senate demand action climate change
0,well lisa look like 'll shoveling four foot global warming tomorrow homer simpson
0,climate change scam curb global population utah legislator say fact check hjr12 point 1 proposed
0,studied eah science undergrad & grad student proven science fact open debate like global warming
2,ditch cardio rapid fat loss screaming climate change clinical trial collagen clinique clip ar
0,plz & sean hannity snow storm contradict climate change
0,fox ca n't make stuff senate hearing global warming cancelled due 2 weather ai n't warm weather either lem tell u
1,much trouble global warming mean agriculture ask wine industry
0,lie could seriouly believe global warming
2,u senator prepare compromise climate change bill doa
1,climate denial crock week 's cold 's climate change washington
2,betting climate change corporation stand make lose billion planet really warming ask
0,lie could seriouly believe global warming
0,believe global warming international conspiracy perpetrated ge order sell air conditioner
1,predicting future climate change via 4000 year old sediment via
1,home subject change picture
0,winter likely put dagger hea global warming cause rightwing republican put together
2,klein a5050chance senate pass climate change bill year
0,ipcc 's latest climate change blundeo boldly go stupidity gone
2,f obama administration proposes new climate service examine repo global warming decide new agency deliver relia
1,omg bill o'reilly fucking debate climate change real 's manmade aslkdgldkhag odskjhyagpo
1,global warming make blizzard worse scintilla respect leftisttimemagazineyou
1,fighting povey global warming africa marc gunther 04212010 2210 0 comment 0 view rarely
2,get ex back screaming climate change clinical trial collagen clinique clip cloth
1,military lead fight climate change pew washington reuters u military government 's large
1,j & k governor warns danger climate change dnaindiacom via
1,global warming study say arctic ice melt cost global economy $ 24 trillion
1,climate change continues melt glacier national park 's icon national p via
0,climate change weather 's difference
0,video fuel climate change skeptic
2,one hot topic k12 web site global warming gail junionmetz school library journal 512010
1,overview green car revolution going green increasing awareness threat global warming
0,global warming fairy tale dick chaney n't drive suv 200000 year ago maybe
2,industry insider michaelangelo l'acqua global warming michaelangelo l'acqua first entered high stake
2,uncajoe plz medium done global warming debate
0,idea care safety silly global warming massey energy 29 dead miner
2,tuesday open thread climate change edition big government via
2,paul rogat loebsoul citizenexcerptfrom drunken pay girl climate change activist
1,hey wow new federal climate change agency announced
2,watch pocahontas star interviewed climate change conference bolivia
0,oh well go global warming theory lol
2,un agrees host two round climate change talk summit mexico
0,mcewan take global warming solar nan talesedoubleday 287 page $ 2695 ian mcewan
0,yeah 's like global warming real anything one justify something fake
2,senate global warming hearing cancelled
2,tale 2 issue immigration reform getting traction climate change senate
1,ocean reveal fuher impact climate change increasing acidity world 's ocean acidity
1,change make farmer & pastoralists increasingly vulnerable
1,hate global warming
2,brilliant tip valentine 's day screaming climate change clinical trial collagen clinique clip
0,new hannity snow stormscontradict gore 's global warming theory
1,china active serious tackling climate change say vice president humani via
0,co2 projection global warming false projection prediction co2 concentration
2,betting climate change corporation stand make lose billion planet really warming ask
1,way stop global warming fundamental way could stop global warming
1,icecovered volcano may answer climate change question eruption mountain iceland 's eyjafjallajo
1,climate change forest absorbing carbon say activist
1,good news co2 may cause even global warming originally thought
2,james j mccahy phd 's time president obama set record straight climate change recent
1,economist say climate change bad economy
1,finally read krugman 's climate change building green economy nytimescom definitely wohwhile
1,take action help protect wildlife habitat climate change 34
2,pm 's stand copenhagen snub un climate change secretariat india time india via
2,nohrop bob grumman mcdonnell believe global warming david swanson author page 1 1 pa
0,oh well go global warming theory lol
0,well lisa look like 'll shoveling four foot global warming tomorrow homer simpson
0,calling al gore dc need global warming please respond asap
1,filmmaker travel globe find people fighting climate change
1,key fixing global warming china magazine 's late november 2009 u energy secretary steven chu
2,msnbc 's ratigan blamessnowpocalypseon global warming
1,climate change blog california academy science via
1,global warming totally messing weather pattern world causing violent weather storm worldwide huful
0,think agree prius disaster prof global warming n't exist
1,government repo say global warming may cause cancer mental illness cnsnewscom
2,green scientist search climate change clue studying aftermath volcano plane ban
0,youtube thomas sowell global warming manufactured intellectual commentator
0,senate global warming meeting hold record snow fall yes disproves global warmingif ur illiterate
1,coalition tired waiting fighting climate change ground level
2,lawmaker spar $ 43m epa 's climate change program sen
2,environment minister jairam ramesh say india suppos pachauri remaining chair intergovt climate change panel despite himalayan blunder
1,namibia govt get active climate change
0,global warming alarmist discredited would n't know rhetoric eah day
0,nice reasonable challenge global warming hype
2,tom switzer australia 's changing climatechange climate
0,2nd someone call al gore ask make turn global warming back
1,climate change & volcanic activity ice cap thaw may awaken icelandic volcano
0,rated youtube video 5 5 star snobama dc 's 2010 snow blast obama ipcc & global warming
0,'m feeling global warming 'm sore digging 2 foot snow
2,graham 's exit put climate change bill limbo
2,un climate change body blasted greenpeace
0,hey al gore could sprinkle global warming fairy dust car tonight 're supposed get 1014 inch snow morning
2,senate global warming hearing cancelled
0,global warming real cold small collection editorial caoons amusement
0,climate change exists summer fall winter & spring
1,impact climate change extend human health
2,great global warming collapse
0,oh snow time overreact make incomprehensible global warming joke
2,uploaded youtube video maximsnewsnetwork energy & climate change un 's ban kimoon untv
1,climate change increase heat wave flood washington reuters death heat wave propey damage
1,epa issue repo u climate change indicator warming measurable effect across ecosystem
2,ditch cardio rapid fat loss screaming climate change clinical trial collagen clinique clip ar
1,u government find pika risk climate change u government p
2,new federal climate change agency forming national ocean service
1,crop production global warming melting away doc
2,evo morale open climate change conference tiquipaya via
1,review yesterday 's discussion science mobilize fight climate change rebekah mintzer
2,get ex back screaming climate change clinical trial collagen clinique clip cloth
2,npr 's science friday global warming
2,podcastunrest thailand iran 's nuclear summit dc climate change conference sasc debate ballistic missile defense
0,climate change fraud global warming balancing quote saying oxburgh
2,eah day talk cuny 3pm + 630pm illuminating science climate change aists + scientist speaking
1,17 moral authority takeaway geoeng lot risk runaway climate change
1,someone please explain conservative climate change area get colder weather pattern shift
