existence,tweet
1,astronaught post beautiful pic maldives space island set sink due impact change
2,gov christie cut nj 's globalwarming fund gov chris christie taking $ 65 million entire allocation fro
2,exxon falsified climate change data
1,blog preliminary analysis suggests natural gas could contribute far global warming previously
2,expensive provision governor 's global warming task force remain new substitute amendment
2,noon foxnewscomgene koprowski seek expes audit ipcc climatechange repo
0,'re one 10 thousand without power blizzard voted global warming dipshit 'm glad 're fd
0,jake whitney hoax climate change hoax climate changeskepticshave singing victory song
1,epa make case climate change green blog nytimescom change
2,immigration reform climate change tale two issue senate
2,choice wont change world one might
1,global warming great threat climate change serious urgent growing president ob
0,hey hey know get 's goat lol either lake level truth global warming hahaha
2,greenhoof blog archive tobacco climate change
1,ocean saltiness show global warming intensifying water cycle
0,senate global warming meeting hold record snow fall yes disproves global warmingif ur illiterate
0,honest shocking medium matter still using junk science 2007 ipcc repo global warming
2,focus aicle municipal level climate change policy china u peter koehn explains
1,maple syrup snow pack global warming happening stop global warming
0,another blizzard happened global warming & gt lol ask al gore
0,2 quote ackroyd 's snl anchor joy behar u ignorant slut believe global warming u mock palin ur idiot
1,kuna indian prepare relocation traditional home sink due climate change
0,climate change fraud global warming catastrophe surplus people pretending know th
0,ipcc 's latest climate change blundeo boldly go stupidity gone
0,obama 2 create new agency dealing climate change serious
1,los angeles job *ft work greenpeace stop global warming $ 12 $ 13hr*
1,dear stupid people think winter storm mean 's thing global warming 're stupid love shut
1,climate change mean arab country arab environment watch via
1,africa continent get u $ 2972 billion combat climate change developed country set
2,graham threatens pull energy bill sponsorship senator lindsey graham central architect climate change
2,climate scientist sue newspaper forpoisoningglobal warming debate
2,graham 's exit talk put climate change bill limbo climatechange bill scheduled unvei
1,government scientist suggest interagency fuzzy hub deal mass extinction brought climate change
1,global warming today blog archive tackle global way present reduce greenhous
1,global warming ocean chemistry changing faster 800000 year 's carbon
2,global warming fact myth daily green
0,brkg news un climate change panel get f scientist announces rehabilitate suing iceland volcanic eruption
1,claiming snow disproves global warming like gf w 12 strapon & claiming big dick
2,global warming james cameron genocidal maniac either james cameron genocidal maniac ' blackheae
1,global warming science good news soil release le carbon though world warms
0,pay noyup n't want government regulating something vague climate change
1,renewable energy advance ocean saltiness show global warming pulling data 16 million salinity
0,3minute eah day video fails mention global warming hoax '
1,disprove dishonest scientist & gt bet think snow disproves climate change idiot
0,bogus global warming consensus fading fast
0,make sense think agree prius disaster prof global warming n't exist
2,environment minister jairam ramesh say india suppos pachauri remaining chair intergovt climate change panel despite himalayan blunder
1,addressing global warming retrain coal worker green job
0,british public become increasingly sceptical change bbc via
2,understanding climate change 's ap
1,global climate yes still warming stop global warming
0,made number false data east coast buried snow reason keep pushing global warming control money
0,fox ca n't make stuff senate hearing global warming cancelled due 2 weather ai n't warm weather either lem tell u
2,shell 's climate change cause blogosphere meltdown
1,66 % hispanic tackling climate change ahighorvery highpriority
1,global warming hit rice production repo opalesque commodity briefing free daily update covering
2,tension set wedding ring found style fit every climate change clinical trial collagen
1,climate change migration pattern changed 20 billion bird
2,climate lindsay graham 's suppo climate change legislation changed today lindsey graham
1,farm u went organic could rest easy abt climate change 10 thing know organic farm
1,wolverine match climate change forget polar bear penguin charismatic megafauna suffering
0,effect al gore'sglobal warming
0,grrrrglobal warming butt 2nd major snowstorm within day
1,person 65 degree day weather n't even surprise anymore person global warming win
1,take action help protect wildlife habitat climate change 30
0,sign apocolypse winter evidence global warming winter brr boo brrr
0,climatechange fanatic corrupted science michael barone gopusa
2,calif trucking assn join fight suspend state 's climatechange law e & enewspm
1,state dept declares global warming unequivocal primarily humaninduced
0,turn groundhog saw shadow day 6 week winter wheres global warming people
1,video msnbc 's brewer claim heavy snowfall prof global warming
0,people r ceifiably insanethere 's freaking global warming & old crank jane fonda & rest cont
1,million protest global warming found al gore
0,blankenship mine safety regulator silly global warming
2,climate change new faith simon hogga 's week guardian guardian via
2,foe california 's global warming law pour money campaign delay
1,world changing 29 graph climate change science one place one stop shop
1,global warming make iceland 's volcano angry melting glacier around world could trigger global
1,u fish wildlife service say pika imperiled climate change obama administration determined
1,global warming threatens armenia 2c higher temperature
2,climate bill placed hold senate dispute ap ap longawaited climate change legislation put
1,china daily rich world never accept finding change till money made
2,rim winning risk managersminds climate change
0,global warming suspended due cold weather
2,people 's world referendum climate change
1,gecko 10 first step greener living seems daunting climate change carbon credit mention gecko
1,china key fixing global warming rapid expansion come sizable environmental impact world 's
0,story collapse great climate scam warming
1,cfc ban global warming 's pilot episode
0,turn groundhog saw shadow day 6 week winter wheres global warming people
0,senate global warming meeting hold record snow fall yes disproves global warmingif ur illiterate
0,barrier lack good data weather modification climate change would like see back envelope
1,california network monitor globalwarming emission
1,global warming melting away doc crop production
2,senator lindsey graham could return fold back climate change
1,rachel harris gender & climate change & renata sivacolundhu undpi un & human right au
1,according 's snowing al gore must fat something 's global climate change might want look
0,skeptic 's corner voter take global warming bit le seriously fromrasmussen repo monday april 19 2010 v
0,30 inch snow dc winter everywhere global warming yet myth persists
0,rated youtube video 5 5 star snobama dc 's 2010 snow blast obama ipcc & global warming
2,chaer assembly social movement global people 's conference climate change
1,plan b california brace climate change california lead fellow state mitigating climate change
0,exposing global warming crapola
1,since man ca n't mother nature end global warming volcano & eahquakes
0,oh well go global warming theory lol
2,democratic leader move immigration bill ahead climate change senate via
2,climate change make world smellier
1,eaah global warming stay deal
2,ga dmana2sama aja panasssohhhhglobal warming
0,mark steyn climate change scientific scandal also massive journalistic failure
1,wishing cochabamba people 's world conference climate change right mother eah
2,graham 's exit talk put climate change bill limbo
1,greennet internet computing fight climate change internet software computing via
1,vancouver winter olympics pinched climate change humanitarian news via
2,frontier repo young people & climate change unfpa
2,global warming fact myth daily green
1,interesting dc blizzard proof global warming
1,climate change place see disappeahe america photo
0,lindsay graham getting public love obama someone need tell graham climate change proven lie
0,put end stupid global warming crap ask perves explain time ice age george dick driving suv 's suppose
1,state climate bill efficiency count toward renewable mandate scaledback global warming bill would enable
0,global warming real cold editorial caoonists scientist word
1,take action help protect wildlife habitat climate change 34
2,finding right gift give wedding guest climate change clinical trial collagen clin
1,global warming today blog archive tackle global way present reduce greenhous
1,white house want church advance climate change agenda kosmosnet via
2,new school climate change panel heritage 's david kreutzer asked audience wait 3 min throwing water bottle
1,climate change affect subterranean ecosystem change ground higher concentration carbon
0,cow fa exonerated global warming al gore sigh huge relieffrom rectum
1,study se asia hit hard climate change via
0,climatechange fanatic corrupted science michael barone gopusa
1,geol society update statement humandriven climate change synching ipcc nat acad agu etc
2,climate worsening debate global warming 's university east anglia 's climate resear
0,blankenship called safety regulator silly global warming
2,scorn ridicule un global warming body
0,yo al gore 's global warming
0,nuclear winter ensue much 4 global warming ppl control planet influence
0,'s settled global warming science sloppy according last ipcc repo published 2007 55 %
1,tobacco climate changemerchants doubtundermined science via
1,repo open green tech open business model climatechange oriented technology transfer
1,cleaner air could speed global warming air pollution news
1,fighting povey global warming africa marc gunther 04212010 2210 0 comment 0 view rarely
1,warming win global warming war kiddo florida nice n't miss much think newyork 's waiting r
2,trigger number online roulette scam screaming climate change clinical trial collagen clinique cl
2,check video george carlin global warming
1,whale poo save world global warming save whale 'll save say australian scientist
1,warming win global warming war kiddo florida nice n't miss much think newyork 's waiting r
2,water war climate change thehea bolivia
0,wait global warming trendis hear anyway
1,really think snowstorm disprove change yup show idiotic
2,ask minister climate change energy election debate & lt & lt send q msg u
2,ask minister take pa online climate change energy election deba via
0,former vp al gore continue perpetuate fantasy ofmancaused global warming ' political lemming
2,going big health care democrat still plan legislation bank reform climate change immigration
1,forest growing fasterclimate change appears driving accelerated growth science daily
0,tweetdeck frozen global warming
1,take action help protect wildlife habitat climate change 32
1,atmospheric carbon dioxide causing climate change also negatively affecting marine environment ^ab
0,fabricate climate change evidence via
2,via cnnbrk graham 's exit talk put climate change bill limbo
1,mayor call londonersideas help tackle climate change via
0,see warning another 1020 snow wish girl still used 3 can aquanet per day speed global warming process
2,tv weathercasters divided global warming half believe phenomenon exists say 's scam
1,756 bad thing attributed global warming
0,scam another warmist rescued arctic cold global warming activisttranspoed
0,climatechange fanatic corrupted science michael barone gopusa
1,change good thing ask climate michael scott
1,live tonight fellow heather rogers join climate change expe james hansen discus real solution climate
0,put end stupid global warming crap ask perves explain time ice age george dick driving suv 's suppose
1,senator prepare compromise climate change bill yahoo news via
0,whiche lie distoion truth referring congressional perk global warming
1,30 major league baseball team throw curve climate change denier cleantechnica
2,nytimesandrew revkin matthew nisbet urge better communication climate change
0,towhhall column michael barone climatechange fanatic corrupted science
2,olympics organiser desperate climate change
2,montanan lobby delegation climate change
2,legislative steamrolling kathryn jean lopez april 26 bloomberg immigration climatechange legisl
2,congress worked health care climate change next
0,global warming liberalsacred cowsa secular religion
2,understanding climate change 's ap
0,global warming nutjobs sign 's going keep snowing dc al gore cry uncle
0,legislature global warming conspiracy examinercom ap photo state representative mike noelr kanab believ
1,added patrick parenteau vermont law school feb 22 webinar disclosing climate change business impact
1,attend tribeca film festival home see climate change documentary via
2,alexia park global warming hea
2,bisa ngebantu buat ngurangin global warming
2,california 's globalwarming law attack age stupid
2,pachauri face fresh call resign source time india embattled head un 's climate change panel r k
2,believe global warming al gore democratic idea influencing al gore global warming
2,new school climate change panel heritage 's david kreutzer asked audience wait 3 min throwing water bottle
0,think agree prius disaster prof global warming n't exist
2,betting climate change
1,climate change impact vulnerability eastern himalaya
0,american public remains quite uninformed regarding shabbysciencebehind manmade global warming scare
2,photo protester take valero initiative would change california 's landmark climate bill
0,'m sick hearing global warming crap 's natural thing n't exist 'd happen anyway
2,scorn ridicule un global warming body
1,vancouver winter olympics pinched climate change humanitarian news via
2,new strategy senate 's climate bill leaf global warming global warming policy longer driving compr
1,issue global warming must dealt 's time alternative energy source wo n't harm planet
0,american public remains quite uninformed regarding shabbysciencebehind manmade global warming scare
0,2 ft snow ground obama administration press conference announce global warming tracker clueless
1,alaska effect global warming pic
2,new delay senate climate change bill
1,snow consistent w global warming say scientist telegraph
1,ice ice baby get lowdown ice & climate change next series 5 question
0,n't upset volcano causing global warming
0,drspencehe illusion sensitive climate system warming change
0,seriously libs really reaching ha time mag global warming make blizzard worse
0,watchingjoseph d'aleo full interview global warming hoaxat vodpod
0,ppl ca n't think 4 'll cont 2 believe global warming even believe snow storm prove idiot malleable
2,
1,pa 1 three pa series challenge communicating climate change
2,john fugelsang climate change coal go shopping gun advocate rallied week suppo rig
0,n't think 's global warming seriously think 're headed ice age
1,volcanic ash cloud global warming may trigger volcano climate change could spark more'hazardous '
0,like newt ca n't suppo anyone give credence global warming
1,new vid climate change & indigenous people robby romero
0,climbing dark top 10 global warming myth ipcc taking real heat everyday p
0,logical analysis p niche modeling disproving global warming ii
1,wa drought isproof climate changeaap humanitarian news via
1,great thing global warming
0,'s global warming treating anyone seen al gore photo show recordbreaking snow maryland
1,yet another gift global warming increased allergy attack
0,snow blamed global warming mean global cooling mean oh know 's bull anyway
0,political talk show discus global warming science fiction
2,arizona 's immigration law climate change legislation stallingwhich issue congress focus poll
0,another dc snowstorm 's global warming
1,think allergy bad wait climate change kick michig
1,'m embarrassed live country elected official cite snowstorm proof global warming hoax
1,66 % hispanic tackling climate change ahighorvery highpriority
1,climate change long enough culture change ie harvard universityvia glen schultz
0,time attack soft underbelly unsubstantiated global warming alarmism
1,eah day resource coping climate change
2,intl news climate deal year say un climate change chief prospect htt
1,lovely another foot global warming coming way weekend
2,initiative campaign suspend global warming law ab32 repos $ 973k raised $ 500k oil comp valero
2,climate change bill stall amid epic immigration soie
2,trigger number online roulette scam screaming climate change clinical trial collagen clinique cl
1,u glacier response climate change complex impact via
0,27 global warming fell home 8 mile south washington dc arm & hand sore shoveling hus tweet
2,change film festival demand
0,lindsay graham getting public love obama someone need tell graham climate change proven lie
1,water core climate change impact un expes reuters humanitarian news via
1,love seeing ice chunk east river 's like little eah fighting global warming tooth nail
2,malthusian prophet backing climate change latimescom via
0,clearly disproving global warming 's going keep snowing dc al gore cry uncle
2,global warming play decide info & discussion game structured discussion three stage global
0,someone try tax cut & ignore climate change approach economic growth history say ca n't fail
2,skirmish renewed un global warming conference climate talk nearly ground halt began
1,third farmer hit climate change 23042010 farmer weekly via
2,global warmingwe available facebook twitter orkut & edinwe recently got interviewed rohini 935 red fm
2,foe california 's global warming law pour money campaign delay
0,trust scientist global warming didnt know pluto wasnt fucking planet
1,snow winter disproves global warming hot day summer prove
1,invasive news invasive specie thriving period climate change world sentinel invasive specie thriving
0,20 snow ok 's everyone go buy aerosol go outside sta spraying 'm cheering global warming
0,sign apocolypse winter evidence global warming winter brr boo brrr
0,finally proof global warming co2 emission hoax familysecuritymattersorg
0,global warming busted president
2,sec 's new interpretive guidance open door climate change disclosure suit
1,reading allergy worse ever blame global warming
2,new federal climate change agency proposed
0,proof 's climate change 75ft killer tsunami created peruvian lake glacier fracture & fall lake
1,mountain v valley temp stretch apa climate change
1,ethiopia climate change increasing povey vulnerability
1,cquestor carbon market climate change news letter
2,science another religion pt1 warming change
0,majority disbelieve manmade global warming propaganda via
0,put end stupid global warming crap ask perves explain time ice age george dick driving suv 's suppose
1,climate change causing change ocean chemistry unprecedented rate
2,democratic leader move immigration bill ahead climate change senate priority washington ap senate
0,global warming plot coloradoans get oceanfront propey without moving
0,great global warming collapse via al gore rest chicken little crowd need punishment
2,dear people side global warming debate 's coldhotsnowydry x day n't provedisprove anything
0,scientific community scamed global green gov warming scam
1,rather amused climate change denier wryly refer snow asglobal warming 're bit closer mark think
1,intel threat assessment climate change compare09 to10 surprisingly interesting
2,india need research climate change shyam saran via
1,tulip midapril chicago love global warming
2,epa make case climate change
2,photo protester take valero initiative would change california 's landmark climate bill
1,key fixing global warming china energy secretary steven chu want change way people think
1,climate change long enough culture change ie harvard universityvia glen schultz
2,tip adopting canine screaming climate change clinical trial collagen clinique clip cl
0,great global warming collapse
0,computer forensics expes still idiot belive global warming true
0,obama new hitler campus disappointment 'll graduate believing global warming & unemployed get clue
2,people 's world conference climate change week april 1922 7500 people 100 country
0,cambio climtico poblacin global warming skepticism finally made latin america
2,brilliant tip valentine 's day screaming climate change clinical trial collagen clinique clip
1,fight climate change front 4
2,good infoeasy read ir pro read sec climate change disclosure release guidance
2,n't cruel 's effect al gore 's global warming
2,un climate change body blasted greenpeace
2,gawker logic repo lindsey graham 's climate change bill flipflop polidicks
1,daniel c esty climate change plan b bringing greenhouse gas emission cap trade system tr
0,someone go tell climate change crowd go hang read
2,state antiglobal warming bill probably dead
0,great global warming collapse via al gore rest chicken little crowd need punishment
1,namibia govt get active climate change
2,getting hot water evangelicals global warming benjamin b phillips since 2000 various evangelical gr
0,tweetdeck frozen global warming
0,freezing still southern california global warming fanatic come visit wear hat glove jacket
2,press release april 2010 climate change negotiator agree intensified
1,sec want climate risk disclosed analysis & opinion reuters sec see climate change risk im
1,brad delong 's prescription battling climate change economics blogger bradford j delong posted plea
1,must see place disappear europepics global warming prediction prove true foll
1,global warming update
1,yeha $ 50million climate change orgs budget best spent adveising instead knowfighting climate chng
2,senate dispute put climate legislation hold associated press washington longawaited climate change
0,political talk show discus global warming science fiction
2,dr michael mann cleared tweaking change data second inquiry way
2,science scientist explore evolution climate change
2,removal mole screaming climate change clinical trial collagen clinique clip
2,2 round climate change talk hosted un summit mexico
2,graham 's exit talk put climate change bill limbo
2,aic sea ice repos believe warming change
0,plz & sean hannity snow storm contradict climate change
1,spill + coal mine tragedy = need alt energy gulf coast spill better give climate change legislation momentum
2,immigration reform climate change tale two issue senate
2,global warming science noaa climate service obamas answer ipcc
1,effect organic farming climate change organic eah
0,agree lawmaker climate change ruse control population
2,'s luntzclimate change memo
0,think agree prius disaster prof global warming n't exist via
2,graham 's exit put climate change bill limbo
0,great global warming collapse
2,webb tout global warming depament little rock arkansas lawmaker authored legislation created
0,climate change loser bad better dumb buyer
2,rudd versus abbott climate change 's difference crikey
2,watching & gt & gt sting wife talk cnn climate change
2,uiy climate bill placed hold senate dispute ap ap longawaited climate change legislation
1,climate change u tree colorado dying enough water calif hurricane katrina act man
0,oops rfk jr 15 month ago global warming mean snow cold dc
2,thr climate bill give polluter nuclear break washington reuters u climate change bill expected
1,reversing forest decline combat climate change
1,global warming retreat except california 's government state air board wisdom continues advanc
1,climate changeing allergy nrdc
1,watch video climate change threatens sacred tibetan mountain including land known shangrila
2,state 's global warming bill may vote pas madison wi wtaq might enough vote
0,washington dc take snow day global warming n't think
2,new york timesandrew revkin au 's matthew nisbet urge better communication climate change
2,new blog post mandating energy benchmarking next step city addressing change
0,tweetdeck frozen global warming
2,science another religion pt1 warming change
1,love burn hotter global warming killing eah
1,new fact suppo global warming case recent letterwriter charles kesner either outoftouch reliable ne
0,medium matter still using junk science 2007 ipcc repo global warming
1,climate change scientist turn inuit research via
1,un battle povey global warming newkeralacom online news un battle povey global warming new
1,gingrich defends global warming commercial pelosi
1,cool global warming bad enough without heating thing interest honest discussion
1,bat bird lizard fight climate change bird bat lizard may play impoant role eah 's cl
0,saying n't gore wo n't give global warming gig still think invented internet
0,talk climate met offer useful note realism climate change headsand need change head
2,12 % american worried global warming epa make case climate change
0,first global cooling global warming 's climate change aka weather simple
1,climate change theory long predicted increased ocean temp would lead sever storm
2,simple tip shopping grooved tungsten ring online climate change clinical trial collagen c
0,comedian joked n't know global warming manmade know global warming data manmade
0,according time mag blizzard result man made global warming got ta love
2,change film festival demand
2,declaration woman asia climate change
2,global warming tube explanation enjoy
0,nice reasonable challenge global warming hype
0,global warming anyone would found would havent looked yet
